<?xml version="1.0" encoding="UTF-8"?>
<dataroot xmlns:od="urn:schemas-microsoft-com:officedata" xmlns:xsi="http://www.w3.org/2001/XMLSchema-instance"  xsi:noNamespaceSchemaLocation="NewPlayers.xsd" generated="2013-04-07T07:59:17">
<tblPlayers>
<FirstName>Sandy</FirstName>
<LastName>Franklin</LastName>
<Height>62</Height>
<PlayerNo>4</PlayerNo>
<YearInSchool>Fr</YearInSchool>
<Position>G</Position>
<HomeTown>Des Moines</HomeTown>
<HomeState>IA</HomeState>
</tblPlayers>
<tblPlayers>
<FirstName>Lori</FirstName>
<LastName>Sandereson</LastName>
<Height>67</Height>
<PlayerNo>5</PlayerNo>
<YearInSchool>Fr</YearInSchool>
<Position>G</Position>
<HomeTown>West Des Moines</HomeTown>
<HomeState>IA</HomeState>
</tblPlayers>
<tblPlayers>
<FirstName>Ellen</FirstName>
<LastName>Harding</LastName>
<Height>69</Height>
<PlayerNo>12</PlayerNo>
<YearInSchool>Fr</YearInSchool>
<Position>G</Position>
<HomeTown>Minnetonka</HomeTown>
<HomeState>MN</HomeState>
</tblPlayers>
<tblPlayers>
<FirstName>Allison</FirstName>
<LastName>Harris</LastName>
<Height>70</Height>
<PlayerNo>21</PlayerNo>
<YearInSchool>Fr</YearInSchool>
<Position>F</Position>
<HomeTown>Springfield</HomeTown>
<HomeState>IL</HomeState>
</tblPlayers>
<tblPlayers>
<FirstName>Terry</FirstName>
<LastName>Garfield</LastName>
<Height>70</Height>
<PlayerNo>22</PlayerNo>
<YearInSchool>Fr</YearInSchool>
<Position>F</Position>
<HomeTown>Dallas</HomeTown>
<HomeState>TX</HomeState>
</tblPlayers>
<tblPlayers>
<FirstName>Sara</FirstName>
<LastName>Richards</LastName>
<Height>60</Height>
<PlayerNo>23</PlayerNo>
<YearInSchool>So</YearInSchool>
<Position>G</Position>
<HomeTown>Bridgewater</HomeTown>
<HomeState>IA</HomeState>
</tblPlayers>
<tblPlayers>
<FirstName>Amy</FirstName>
<LastName>Scallia</LastName>
<Height>70</Height>
<PlayerNo>30</PlayerNo>
<YearInSchool>Fr</YearInSchool>
<Position>F</Position>
<HomeTown>Manhattan</HomeTown>
<HomeState>KS</HomeState>
</tblPlayers>
<tblPlayers>
<FirstName>Ashley</FirstName>
<LastName>Welker</LastName>
<Height>73</Height>
<PlayerNo>32</PlayerNo>
<YearInSchool>So</YearInSchool>
<Position>C</Position>
<HomeTown>Minot</HomeTown>
<HomeState>ND</HomeState>
</tblPlayers>
<tblPlayers>
<FirstName>Kayla</FirstName>
<LastName>Carter</LastName>
<Height>73</Height>
<PlayerNo>35</PlayerNo>
<YearInSchool>So</YearInSchool>
<Position>F</Position>
<HomeTown>Lincoln</HomeTown>
<HomeState>NE</HomeState>
</tblPlayers>
<tblPlayers>
<FirstName>Diane</FirstName>
<LastName>Farmingham</LastName>
<Height>70</Height>
<PlayerNo>42</PlayerNo>
<YearInSchool>Jr</YearInSchool>
<Position>F</Position>
<HomeTown>Madison</HomeTown>
<HomeState>WI</HomeState>
</tblPlayers>
<tblPlayers>
<FirstName>Martha</FirstName>
<LastName>Howison</LastName>
<Height>74</Height>
<PlayerNo>45</PlayerNo>
<YearInSchool>Jr</YearInSchool>
<Position>F</Position>
<HomeTown>Greenfield</HomeTown>
<HomeState>IA</HomeState>
</tblPlayers>
<tblPlayers>
<FirstName>Mary</FirstName>
<LastName>Thomas</LastName>
<Height>71</Height>
<PlayerNo>51</PlayerNo>
<YearInSchool>So</YearInSchool>
<Position>G</Position>
<HomeTown>Cherokee</HomeTown>
<HomeState>MN</HomeState>
</tblPlayers>
<tblPlayers>
<FirstName>Judy</FirstName>
<LastName>Jacobson</LastName>
<Height>75</Height>
<PlayerNo>52</PlayerNo>
<YearInSchool>Fr</YearInSchool>
<Position>F</Position>
<HomeTown>Fontanelle</HomeTown>
<HomeState>IL</HomeState>
</tblPlayers>
</dataroot>
